{
  "schemaVersion": 1,
  "projectId": "pbe-example",
  "stage": "rpd",
  "mode": "rpd_tree_walk",
  "currentNodeId": "req-root",
  "autoflow": {
    "schemaVersion": 1,
    "state": "STARTED",
    "enabled": true,
    "profile": "full",
    "completedSteps": ["start"],
    "currentGate": null,
    "nextStep": "rpd",
    "deterministicSteps": [
      "rpd",
      "wpd",
      "vd",
      "dependency_impact_audit",
      "plan_execution",
      "coverage_audit",
      "ux_audit",
      "generate_acep",
      "run_acep"
    ],
    "humanGates": [
      "root_confirmation",
      "ui_ux_confirm",
      "implementation_scope",
      "architecture_runway",
      "review_result",
      "next_slice_decision"
    ],
    "lastUserAction": null,
    "lastFailure": null
  },
  "createdAt": "2026-06-09T00:00:00.000Z",
  "updatedAt": "2026-06-09T00:00:00.000Z",
  "artifacts": {
    "productTree": ".pbe/tree/product-tree.json",
    "projectTree": ".pbe/tree/project-tree.json",
    "workTree": ".pbe/tree/work-tree.json",
    "testTree": ".pbe/tree/test-tree.json",
    "cycleTree": ".pbe/execution/cycle-tree.json",
    "cycleContract": ".pbe/execution/cycle-contract.md",
    "nodeExecutionContracts": ".pbe/execution/node-execution-contracts/",
    "decisionQueue": ".pbe/control/decision-queue.json",
    "changeTree": ".pbe/control/change-tree.json",
    "impactTree": ".pbe/control/impact-tree.json",
    "acceptanceTree": ".pbe/control/acceptance-tree.json",
    "legacyControlInventory": ".pbe/control/legacy-control-inventory.json",
    "surfaceCompletionLedger": ".pbe/control/surface-completion-ledger.json",
    "hardwareReadinessLedger": ".pbe/control/hardware-readiness-ledger.json",
    "visualVerificationProfile": ".pbe/control/visual-verification-profile.json",
    "verificationMissLog": ".pbe/control/verification-miss-log.json",
    "evidenceTree": ".pbe/evidence/evidence-tree.json",
    "projectBrief": ".pbe/blueprint/project-brief.md",
    "pbeRoutingContract": ".pbe/blueprint/pbe-routing-contract.md",
    "sourceOfTruthMatrix": ".pbe/blueprint/source-of-truth-matrix.md",
    "pbeInvariants": ".pbe/blueprint/pbe-invariants.md",
    "foundationContract": ".pbe/blueprint/foundation-contract.md",
    "parallelSafetyContract": ".pbe/blueprint/parallel-safety-contract.md",
    "requirementTree": ".pbe/blueprint/requirement-tree.json",
    "requirementTreeMarkdown": ".pbe/blueprint/requirement-tree.md",
    "rpdInterviewLog": ".pbe/blueprint/rpd-interview-log.md",
    "rpdSummary": ".pbe/blueprint/rpd-summary.md",
    "uiUxPreview": ".pbe/blueprint/ui-ux-preview.json",
    "uiUxPreviewMarkdown": ".pbe/blueprint/ui-ux-preview.md",
    "uiUxConfirmation": ".pbe/blueprint/ui-ux-confirmation.md",
    "uiUxConfirmationLog": ".pbe/blueprint/ui-ux-confirmation-log.md",
    "workDesign": ".pbe/blueprint/work-design.json",
    "workGraph": ".pbe/blueprint/work-graph.json",
    "workRoadmap": ".pbe/blueprint/work-roadmap.md",
    "verificationDesign": ".pbe/blueprint/verification-design.json",
    "verificationPlan": ".pbe/blueprint/verification-plan.md",
    "dependencyImpactAudit": ".pbe/blueprint/dependency-impact-audit.json",
    "dependencyImpactAuditMarkdown": ".pbe/blueprint/dependency-impact-audit.md",
    "executionStrategy": ".pbe/blueprint/execution-strategy.json",
    "executionStrategyMarkdown": ".pbe/blueprint/execution-strategy.md",
    "acep": ".pbe/codex-execution-pack/",
    "traceabilityMatrix": ".pbe/codex-execution-pack/04-traceability-matrix.json",
    "uiUxSpec": ".pbe/codex-execution-pack/05-ui-ux-spec.json",
    "uiUxEvidenceChecklist": ".pbe/codex-execution-pack/15-ui-ux-evidence-checklist.md",
    "finalCoverageCheck": ".pbe/codex-execution-pack/16-final-coverage-check.md",
    "review": ".pbe/review/",
    "revisions": ".pbe/revisions/"
  },
  "deliveryStatus": "waiting_root_confirmation"
}
